{
  "$schema": "../schemas/ipa-conversion-artifact.schema.json",
  "schema_version": "1.0.0",
  "record_id": "demo-1",
  "source": "example-lexicon",
  "language": "tur",
  "source_form": "kitap",
  "normalized_form": "kitap",
  "ipa": "kitap",
  "provider_id": "epitran",
  "provider_version": "1.34.0",
  "profile_id": "tur-Latn",
  "profile_version": "1.0.0",
  "status": "complete",
  "diagnostics": []
}
